"id";"date";"explanation";"title";"link"
52;"2019-03-29";"The striking spiral galaxy M104 is famous for its nearly edge-on profile featuring a broad ring of obscuring dust lanes. Seen in silhouette against an extensive central bulge of stars, the swath of cosmic dust lends a broad brimmed hat-like appearance to the galaxy suggesting a more popular moniker, The Sombrero Galaxy. Hubble Space Telescope data have been used to create this sharp view of the well-known galaxy. The processing results in a natural color appearance and preserves details often lost in overwhelming glare of M104's bright central bulge when viewed with smaller ground-based telescopes. Also known as NGC 4594, the Sombrero galaxy can be seen across the spectrum and is host to a central supermassive black hole. About 50,000 light-years across and 28 million light-years away, M104 is one of the largest galaxies at the southern edge of the Virgo Galaxy Cluster.";"M104: The Sombrero Galaxy";"https://apod.nasa.gov/apod/image/1903/M104_Hubble_rba1024.jpg"
53;"2019-03-30";"Put on your red/cyan glasses and float next to the jagged and double-lobed nucleus of Churyumov-Gerasimenko, also known as Comet 67P. The stereo anaglyph was created by combining two images from the Rosetta spacecraft's narrow angle OSIRIS camera taken on July 25, 2015 from a distance of 184 kilometers. Numerous jets are emanating from the small solar system world's active surface near its closest approach to the Sun. The larger lobe is around 4 kilometers in diameter, joined to a smaller, 2.5 kilometer diameter lobe by a narrow neck. Rosetta's mission to the comet ended in September 2016 when the spacecraft was commanded to a controlled impact with the comet's surface. Keep those 3D glasses on though. You can check out a new catalog of nearly 1400 stereo anaglyphs created from Rosetta image data on this website.";"3D 67P";"https://apod.nasa.gov/apod/image/1903/anaglyph-NAC_2015-07-25T06.28.48.742Z_lamy1024.jpg"
54;"2019-04-02";"What's that unusual spot on the Moon? It's the International Space Station. Using precise timing, the Earth-orbiting space platform was photographed in front of a partially lit gibbous Moon last month. The featured image was taken from Palo Alto, California, USA with an exposure time of only 1/667 of a second. In contrast, the duration of the transit of the ISS across the entire Moon was about half a second.  A close inspection of this unusually crisp ISS silhouette will reveal the outlines of numerous solar panels and trusses.  The bright crater Tycho is visible on the lower left, as well as comparatively rough, light colored terrain known as highlands, and relatively smooth, dark colored areas known as maria.  On-line tools can tell you when the International Space Station will be visible from your area.   Newly Added Venue:  APOD now available on Instagram in Persian";"Space Station Silhouette on the Moon";"https://apod.nasa.gov/apod/image/1904/IssMoon_Holland_960.jpg"
55;"2019-04-03";"The famous Horsehead Nebula in Orion is not alone.  A deep exposure shows that the dark familiar shaped indentation, visible just below center, is part of a vast complex of absorbing dust and glowing gas.  To bring out details of the  Horsehead's pasture, an amateur astronomer used a backyard telescope in Austria to accumulate and artistically combine 7.5 hours of images in the light of Hydrogen (red), Oxygen (green), and Sulfur (blue). The resulting spectacular picture details an intricate tapestry of gaseous wisps and dust-laden filaments that were created and sculpted over eons by stellar winds and ancient supernovas.  The Flame Nebula is visible just to the left of the Horsehead, while the bright star on the upper left is Alnilam, the central star in Orion's Belt. The Horsehead Nebula lies 1,500 light years distant towards the constellation of Orion.    Bounce around the Universe: Random APOD Generator";"Wisps Surrounding the Horsehead Nebula";"https://apod.nasa.gov/apod/image/1904/HorseheadFlame_Zauner_960.jpg"
56;"2019-04-05";"This astronomical sky spanning view is a mosaic from the Pan-STARRS observatory. The images were recorded with its 1.8 meter telescope at the summit of Haleakala on planet Earth's island of Maui. In fact, Earth's north celestial pole is centered in this across-the-sky projection. A declination of -30 degrees, the southern horizon limit as seen from the Hawaiian Valley Isle, defines the circular outer edge. Crowded starfields and cosmic dust clouds along the plane of our Milky Way galaxy stretch across the scene with the bright bulge of the galactic center at the bottom. Compiled over four years, the image data represent the second edition of data from Pan-STARRS (Panoramic Survey Telescope & Rapid Response System), currently the planet's largest digital sky survey. In 2017 Pan-STARRS was used to first recognize the interstellar voyage of 'Oumuamua, visitor to our Solar System.";"Pan-STARRS Across the Sky";"https://apod.nasa.gov/apod/image/1904/STScI-H-1912b-panstarrs1024.jpg"
57;"2019-04-07";"If Scorpius looked this good to the unaided eye, humans might remember it better.  Scorpius more typically appears as a few bright stars in a well-known but rarely pointed out zodiacal constellation. To get a spectacular image like this, though, one needs a good camera, color filters, and a digital image processor.  To bring out detail, the featured image not only involved long duration exposures taken in several colors, but one exposure in a very specific red color emitted by hydrogen.  The resulting image shows many breathtaking features.  Vertically across the image left is part of the plane of our Milky Way Galaxy.   Visible there are vast clouds of bright stars and long filaments of dark dust.  Jutting out diagonally from the Milky Way in the image center are dark dust bands known as the Dark River.  This river connects to several bright stars on the right that are part of Scorpius' head and claws, and include the bright star Antares.  Above and right of Antares is an even brighter planet: Jupiter. Numerous red emission nebulas and blue reflection nebulas are visible throughout the image. Scorpius appears prominently in southern skies after sunset during the middle of the year.";"A Scorpius Sky Spectacular";"https://apod.nasa.gov/apod/image/1904/scorpio_guisard_960.jpg"
59;"2019-04-12";"The Rosette Nebula, NGC 2237, is not the only cosmic cloud of gas and dust to evoke the imagery of flowers, but it is the most famous.  At the edge of a large molecular cloud in Monoceros some 5,000 light years away, the petals of this cosmic rose are actually a stellar nursery. The lovely, symmetric shape is sculpted by the winds and radiation from its central cluster of hot young, O-type stars. Stars in the energetic cluster, cataloged as NGC 2244, are only a few million years young, while the central cavity in the Rosette Nebula, is about 50 light-years in diameter. The nebula can be seen with a small telescope toward the constellation of Monoceros, the Unicorn. This natural appearing telescopic portrait of the Rosette Nebula was made using broadband and narrowband filters, because sometimes roses aren't red.";"A Cosmic Rose: The Rosette Nebula in Monoceros";"https://apod.nasa.gov/apod/image/1904/JMD_Rosette_Rotated1024.jpg"
60;"2019-04-13";"Rigil Kentaurus is the bright star near the top of this broad southern skyscape. Of course it's probably better known as Alpha Centauri, nearest star system to the Sun. Below it sprawls a dark nebula complex. The obscuring interstellar dust clouds include Sandqvist catalog clouds 169 and 172 in silhouette against the rich starfields along the southern Milky Way. Rigil Kent is a mere 4.37 light-years away, but the dusty dark nebulae lie at the edge of the starforming Circinus-West molecular cloud about 2,500 light-years distant. The wide-field of view spans over 12 degrees (24 full moons) across southern skies.";"Rigil Kentaurus and Sandqvist 169";"https://apod.nasa.gov/apod/image/1904/sandqvist169_colombari1024.jpg"
61;"2019-04-15";"Do you see the dolphin-shaped cloud on Jupiter? The cloud was visible last year during perijove 16, the sixteenth time that NASA's robotic spacecraft Juno passed near Jupiter since it arrived in mid-2016.  During each perijove, Juno passes near a slightly different part of Jupiter's cloud tops.  The dolphin shape may be surprising but is not scientifically significant -- clouds on Jupiter and Earth are constantly shifting and can temporarily mimic many familiar shapes. The cloud appears in Jupiter's South Temperate Belt (STB), a band of dark and dropping clouds that rings the planet and also contains Oval BA, dubbed Red Spot Jr.  The featured image was digitally processed to enhance color and contrast.  Juno's next swoop near Jupiter -- perijove 20 -- will occur on late May.";"Enhanced: The Dolphin Cloud on Jupiter";"https://apod.nasa.gov/apod/image/1904/JupiterDolphin_JunoEichstadt_1080.jpg"
62;"2019-04-16";"Strange shapes and textures can be found in neighborhood of the Cone Nebula. The unusual shapes originate from fine interstellar dust reacting in complex ways with the energetic light and hot gas being expelled by the young stars.  The brightest star on the right of the featured picture is S Mon, while the region just below it has been nicknamed the Fox Fur Nebula for its color and structure. The blue glow directly surrounding S Mon results from reflection, where neighboring dust reflects light from the bright star. The red glow that encompasses the whole region results not only from dust reflection but also emission from hydrogen gas ionized by starlight. S Mon is part of a young open cluster of stars named NGC 2264, located about 2500 light years away toward the constellation of the Unicorn (Monoceros).   Even though it points right at S Mon, details of the origin of the mysterious geometric Cone Nebula, visible on the far left, remain a mystery.";"In the Vicinity of the Cone Nebula";"https://apod.nasa.gov/apod/image/1904/ConeFoxfur_Mishra_960.jpg"
63;"2019-04-17";"One of the brightest galaxies in planet Earth's sky is similar in size to our Milky Way Galaxy: big, beautiful Messier 81. Also known as NGC 3031 or Bode's galaxy for its 18th century discoverer, this grand spiral can be found toward the northern constellation of Ursa Major, the Great Bear. The detailed telescopic view reveals M81's bright yellow nucleus, blue spiral arms, pink starforming regions, and sweeping cosmic dust lanes. Some dust lanes actually run through the galactic disk (left of center), contrary to other prominent spiral features though. The errant dust lanes may be the lingering result of a close encounter between M81 and its smaller companion galaxy, M82. Scrutiny of variable stars in M81 has yielded one of the best determined distances for an external galaxy -- 11.8 million light-years.";"Messier 81";"https://apod.nasa.gov/apod/image/1904/M81salvatore1024.jpg"
64;"2019-04-18";"This group is popular in the northern spring. Famous as the Leo Triplet, the three magnificent galaxies gather in one field of view. Crowd pleasers when imaged with even modest telescopes, they can be introduced individually as NGC 3628 (left), M66 (bottom right), and M65 (top). All three are large spiral galaxies but they tend to look dissimilar because their galactic disks are tilted at different angles to our line of sight. NGC 3628, also known as the Hamburger Galaxy, is temptingly seen edge-on, with obscuring dust lanes cutting across its puffy galactic plane. The disks of M66 and M65 are both inclined enough to show off their spiral structure.  Gravitational interactions between galaxies in the group have left telltale signs, including the tidal tails and warped, inflated disk of NGC 3628 and the drawn out spiral arms of M66. This gorgeous view of the region spans almost two degrees (four full moons) on the sky. The field covers about a million light-years at the trio's estimated distance of 30 million light-years. Of course the spiky foreground stars lie within our own Milky Way.";"The Leo Trio";"https://apod.nasa.gov/apod/image/1904/LeoTrioBauer1024.jpg"
65;"2019-04-24";"The symmetric, multi-legged appearance of the Southern Crab Nebula is certainly distinctive. About 7,000 light-years distant toward the southern sky constellation Centaurus, its glowing nested hourglass shapes are produced by the remarkable symbiotic binary star system at its center. The nebula's dramatic stellar duo consists of a hot white dwarf star and cool, pulsating red giant star shedding outer layers that fall onto the smaller, much hotter companion. Embedded in a disk of material, outbursts from the white dwarf cause an outflow of gas driven away both above and below the disk resulting in the bipolar hourglass shapes. The bright central shape is about half a light-year across. This new Hubble Space Telescope image celebrates the 29th anniversary of Hubble's launch on April 24, 1990 on board the Space Shuttle Discovery.";"The Shape of the Southern Crab";"https://apod.nasa.gov/apod/image/1904/SouthernCrabHST_853x1000.jpg"
66;"2019-04-25";"Ridges of glowing interstellar gas and dark dust clouds inhabit the turbulent, cosmic depths of the Lagoon Nebula. Also known as M8, the bright star forming region is about 5,000 light-years distant. But it still makes for a popular stop on telescopic tours of the constellation Sagittarius, toward the center of our Milky Way Galaxy. Dominated by the telltale red emission of ionized hydrogen atoms recombining with stripped electrons, this stunning view of the Lagoon is over 100 light-years across.  At its center, the bright, compact, hourglass shape is gas ionized and sculpted by energetic radiation and extreme stellar winds from a massive young star. In fact, the many bright stars of open cluster NGC 6530 drift within the nebula, just formed in the Lagoon several million years ago. Broadband image data from Pan-STARRS (Panoramic Survey Telescope & Rapid Response System) was combined with narrowband data from amateur telescopes to create this wide and deep portrait of the Lagoon Nebula.";"Pan-STARRS Across the Lagoon";"https://apod.nasa.gov/apod/image/1904/LagoonPanSTARRS_ColesPugh1024.jpg"
67;"2019-04-26";"Tracking along the southern Milky Way this beautiful celestial mosaic was recorded under dark Brazilian skies. Spanning some 20 degrees it actually starts with the dark expanse of the Coalsack nebula at the lower left, tucked under an arm of the Southern Cross. That compact constellation is topped by bright yellowish Gamma Crucis, a cool giant star a mere 88 light-years distant. A line from Gamma Crucis through the blue star at the bottom of the cross, Alpha Crucis, points toward the South Celestial Pole. Follow the Milky Way to the right and your gaze will sweep across IC 2948, popularly known as the Running Chicken nebula, before it reaches Eta Carinae and the Carina Nebula near the right edge of the frame. About 200 light-years across, the Carina Nebula is a star forming region much larger than the more northerly stellar nursery the Orion Nebula. The Carina Nebula lies around 7,500 light-years from Earth along the plane of the Milky Way.";"Southern Cross to Eta Carinae";"https://apod.nasa.gov/apod/image/1904/FairbairnCROSSTOCARINA.jpg"
68;"2019-04-29";"Massive stars, abrasive winds, mountains of dust, and energetic light sculpt one of the largest and most picturesque regions of star formation in the Local Group of Galaxies.  Known as N11, the region is visible on the upper right of many images of its home galaxy, the Milky Way neighbor known as the Large Magellanic Clouds (LMC).  The featured image was taken for scientific purposes by the Hubble Space Telescope and reprocessed for artistry by an amateur to win a Hubble's Hidden Treasures competition.  Although the section imaged above is known as NGC 1763, the entire N11 emission nebula is second in LMC size only to the Tarantula Nebula.  Compact globules of dark dust housing emerging young stars are also visible around the image.  A new study of variable stars in the LMC with Hubble has helped to recalibrate the distance scale of the  observable universe, but resulted in a slightly different scale than found using the pervasive cosmic microwave background.   Astrophysicists: Browse 1,900+ codes in the Astrophysics Source Code Library";"N11: Star Clouds of the LMC";"https://apod.nasa.gov/apod/image/1904/N11_Hubble_960.jpg"
69;"2019-04-30";"The galaxy was never in danger. For one thing, the Triangulum galaxy (M33), pictured, is much bigger than the tiny grain of rock at the head of the meteor. For another, the galaxy is much farther away -- in this instance 3 million light years as opposed to only about 0.0003 light seconds.  Even so, the meteor's path took it angularly below the galaxy. Also the wind high in Earth's atmosphere blew the meteor's glowing evaporative molecule train away from the galaxy, in angular projection.  Still, the astrophotographer was quite lucky to capture both a meteor and a galaxy in a single exposure -- which was subsequently added to two other images of M33 to bring up the spiral galaxy's colors.  At the end, the meteor was gone in a second, but the galaxy will last billions of years.    Follow APOD on: Instagram, Facebook,  Reddit, or Twitter";"Meteor Misses Galaxy";"https://apod.nasa.gov/apod/image/1904/M33Meteor_Chokshi_960.jpg"
70;"2019-05-01";"To some it looks like a cat's eye. To others, perhaps like a giant cosmic conch shell.  It is actually one of brightest and most highly detailed planetary nebula known, composed of gas expelled in the brief yet glorious phase near the end of life of a Sun-like star. This nebula's dying central star may have produced the outer circular concentric shells by shrugging off outer layers in a series of regular convulsions. The formation of the beautiful, complex-yet-symmetric inner structures, however, is not well understood. The featured image is a composite of a digitally sharpened Hubble Space Telescope image with X-ray light captured by the orbiting Chandra Observatory.  The exquisite floating space statue spans over half a light-year across. Of course, gazing into this Cat's Eye, humanity may well be seeing the fate of our sun, destined to enter its own planetary nebula phase of evolution ... in about 5 billion years.";"The Cat's Eye Nebula in Optical and X-ray";"https://apod.nasa.gov/apod/image/1905/CatsEye_HubblePohl_960.jpg"
71;"2019-05-03";"The Large Magellanic Cloud (LMC) is an alluring sight in southern skies. But this deep and detailed telescopic view, over 10 months in the making, goes beyond what is visible to most circumnavigators of planet Earth. Spanning over 5 degrees or 10 full moons, the 4x4 panel mosaic was constructed from 3900 frames with a total of 1,060 hours of exposure time in both broadband and narrowband filters. The narrowband filters are designed to transmit only light emitted by sulfur, hydrogen, and oxygen atoms. Ionized by energetic starlight, the atoms emit their characteristic light as electrons are recaptured and the atoms transition to a lower energy state. As a result, in this image the LMC seems covered with its own clouds of ionized gas surrounding its massive, young stars. Sculpted by the strong stellar winds and ultraviolet radiation, the glowing clouds, dominated by emission from hydrogen, are known as H II (ionized hydrogen) regions. Itself composed of many overlapping H II regions, the Tarantula Nebula is the large star forming region at the left. The largest satellite of our Milky Way Galaxy, the LMC is about 15,000 light-years across and lies a mere 160,000 light-years away toward the constellation Dorado.";"Clouds of the Large Magellanic Cloud";"https://apod.nasa.gov/apod/image/1905/photo95cielaustral1024.jpg"
72;"2019-05-04";"On February 2nd early morning risers saw Saturn near an old Moon low on the eastern horizon. On that date bright planet, sunlit crescent, and faint lunar night side were captured in this predawn skyscape from Bursa, Turkey. Of course the Moon's ashen glow is earthshine, earthlight reflected from the Moon's night side. A description of earthshine, in terms of sunlight reflected by Earth's oceans illuminating the Moon's dark surface, was written over 500 years ago by Leonardo da Vinci. On May 2nd an old Moon also rose in the predawn twilight. On that date its ashen glow shared the sky with Venus, the brilliant morning star. May 2nd also marked the 500th anniversary of Leonardo's death in 1519.";"Saturn and the Da Vinci Glow";"https://apod.nasa.gov/apod/image/1905/20190202tezel_1024.jpg"
73;"2019-05-07";"What's happening in the center of the Carina Nebula?  Stars are forming, dying, and leaving an impressive tapestry of dark dusty filaments.  The entire Carina Nebula, cataloged as NGC 3372, spans over 300 light years and lies about 8,500 light-years away in the constellation of Carina. The nebula is composed predominantly of hydrogen gas, which emits the pervasive red glow seen in this highly detailed featured image.  The blue glow in the center is created by a trace amount of glowing oxygen. Young and massive stars located in the nebula's center expel dust when they explode in supernovae.  Eta Carinae, the most energetic star in the nebula's center, was one of the brightest stars in the sky in the 1830s, but then faded dramatically.";"The Great Nebula in Carina";"https://apod.nasa.gov/apod/image/1905/CarinaWideField_Willasch_1080.jpg"
75;"2019-05-11";"The Milky Way doesn't look quite this colorful and bright to the eye, but a rocket launch does. So a separate deep exposure with a sensitive digital camera was used in this composite skyscape to bring out our galaxy's central crowded starfields and cosmic dust clouds. In the scene from Merritt Island National Wildlife Refuge, a nine minute long exposure begun about 20 minutes after the Miky Way image recorded a rocket launch and landing. The Falcon 9 rocket, named for the Millennium Falcon of Star Wars fame, appropriately launched a Dragon resupply ship to the International Space Station in the early morning hours of May the 4th. The plume and flare at the peak of the launch arc mark the rocket's first stage boost back burn. Two shorter diagonal streaks are the rocket engines bringing the Falcon 9 stage back to an offshore landing on autonomous drone ship Of course I Still Love You.";"Milky Way, Launch, and Landing";"https://apod.nasa.gov/apod/image/1905/crs17spaceXboggs1024.jpg"
77;"2019-05-14";"Why does star cluster Trumpler 14 have so many bright stars? Because it is so young. Many cluster stars have formed only in the past 5 million years and are so hot they emit detectable X-rays.  In older star clusters, most stars this young have already died -- typically exploding in a supernova -- leaving behind stars that are fainter and redder. Trumpler 14 spans about 40 light years and lies about 9,000 light years away on the edge of the famous Carina Nebula. A discerning eye can spot two unusual objects in this detailed 2006 image of Trumpler 14 by the Hubble Space Telescope. First, a dark cloud just left of center may be a planetary system trying to form before being destroyed by the energetic winds of Trumpler 14's massive stars. Second is the arc at the bottom left, which one hypothesis holds is the supersonic shock wave of a fast star ejected 100,000 years ago from a completely different star cluster.";"Young Star Cluster Trumpler 14 from Hubble";"https://apod.nasa.gov/apod/image/1905/Trumpler14_Hubble_960.jpg"
78;"2019-05-15";"How far away is spiral galaxy NGC 4921? It's surpringly important to know.  Although presently estimated to be about 300 million light years distant, a more precise determination could be coupled with its known recession speed to help humanity better calibrate the expansion rate of the entire visible universe.  Toward this goal, several images were taken by the Hubble Space Telescope in order to help identify key stellar distance markers known as Cepheid variable stars.   Since NGC 4921 is a member of the Coma Cluster of Galaxies, refining its distance would also allow a better distance determination to one of the largest nearby clusters in the local universe. The magnificent spiral NGC 4921 has been informally dubbed anemic because of its low rate of star formation and low surface brightness. Visible in the featured image are, from the center, a bright nucleus, a bright central bar, a prominent ring of dark dust, blue clusters of recently formed stars, several smaller companion galaxies, unrelated galaxies in the far distant universe, and unrelated stars in our Milky Way Galaxy.    APOD in other languages: Arabic, Catalan, Chinese (Beijing), Chinese (Taiwan), Croatian, Czech, Dutch, German, French, French, Hebrew, Indonesian, Japanese, Korean, Montenegrin, Polish, Russian, Serbian, Slovenian,  Spanish and Ukrainian";"Anemic Spiral NGC 4921 from Hubble";"https://apod.nasa.gov/apod/image/1905/NGC4921_HubbleShatz_960.jpg"
