"id";"date";"explanation";"title";"link"
105;"2019-07-02";"If not perfect, then this spiral galaxy is at least one of the most photogenic. An island universe containing billions of stars and situated about 40 million light-years away toward the constellation of the Dolphinfish (Dorado), NGC 1566 presents a gorgeous face-on view. Classified as a grand design spiral, NGC 1566's shows two prominent and graceful spiral arms that are traced by bright blue star clusters and dark cosmic dust lanes. Numerous Hubble Space Telescope images of NGC 1566 have been taken to study star formation, supernovas, and the spiral's unusually active center. Some of these images, stored online in the Hubble Legacy Archive, were freely downloaded, combined, and digitally processed by an industrious amateur to create the featured image. NGC 1566's flaring center makes the spiral one of the closest and brightest Seyfert galaxies, likely housing a central supermassive black hole wreaking havoc on surrounding stars and gas.   Today: Total solar eclipse visible in parts of South America";"NGC 1566: The Spanish Dancer Spiral Galaxy";"https://apod.nasa.gov/apod/image/1907/NGC1566_Shatz_960d.jpg"
106;"2019-07-04";"On July 2 denizens of planet Earth could stand in the Moon's dark umbral shadow during South America's 2019 total solar eclipse. It first touched down in the Southern Pacific Ocean, east of New Zealand. Racing toward the east along a narrow track, the shadow of the Moon made landfall along the Chilean coast with the Sun low on the western horizon. Captured in the foreground here are long shadows still cast by direct sunlight though, in the final moments before totality began. While diffraction spikes are from the camera lens aperture, the almost totally eclipsed Sun briefly shone like a beautiful diamond ring in the clear, darkened sky.";"In the Shadow of the Moon";"https://apod.nasa.gov/apod/image/1907/eclipse_2019_beletsky.jpg"
107;"2019-07-05";"The road to the high mountaintop La Silla Observatory in the Chilean Atacama Desert also led in to the path of July 2nd's total solar eclipse. Recorded at regular intervals before and after the total eclipse phase, the frames in this composite sequence include the moment the Moon's dark shadow fell across some of planet Earth's advanced large telescopes. The dreamlike view looks west toward the setting Sun and the approaching Moon shadow. In fact La Silla was a little north of the shadow track's center line, so the region's stunning, clear skies are slightly brighter to the north (right) in the scene.";"La Silla Eclipse Sequence";"https://apod.nasa.gov/apod/image/1907/2019_07_02_TSE_LaSilla_Sequence_1024px.jpg"
108;"2019-07-06";"The total phase of the July 2nd solar eclipse lasted about 4 minutes and 30 seconds at the point of maximum eclipse. On the surface of planet Earth, that was about 600 nautical miles north of Easter Island in the Southern Pacific Ocean. But from 41,000 feet above, on a charter flight intercepting the Moon's shadow, the Moon could be seen to completely block the Sun for about 8 minutes and 30 seconds. With a tailwind at the mid-eclipse intercept point, the plane was traveling around 488 nautical miles per hour chasing along the Moon's shadow track. From above the clouds this wide-field image of the totally eclipsed Sun and shimmering solar corona over the wing records the spectacular view from a window seat on the sunward side of the aircraft.";"8 Minute and 30 Second Eclipse";"https://apod.nasa.gov/apod/image/1907/MinorTSE_eclipseoverthewing1024.jpg"
109;"2019-07-07";"Saturn never shows a crescent phase -- from Earth.  But when viewed from beyond, the majestic giant planet can show an unfamiliar diminutive sliver. This image of crescent Saturn in natural color was taken by the robotic Cassini spacecraft in 2007. The featured image captures Saturn's majestic rings from the side of the ring plane opposite the Sun -- the unilluminated side -- another vista not visible from Earth. Pictured are many of Saturn's photogenic wonders, including the subtle colors of cloud bands, the complex shadows of the rings on the planet, and the shadow of the planet on the rings. A careful eye will find the moons Mimas (2 o'clock) and Janus (4 o'clock), but the real challenge is to find Pandora (8 o'clock).  Saturn is now nearly opposite from the Sun in the Earth's sky and so can be seen in the evening starting just after sunset for the rest of the night.";"Crescent Saturn";"https://apod.nasa.gov/apod/image/1907/CrescentSaturn_cassini_1080.jpg"
110;"2019-07-09";"What do birds do during a total solar eclipse? Darkness descends more quickly in a total eclipse than during sunset, but returns just as quickly -- and perhaps unexpectedly  to the avians -- just a few minutes later. Stories about the unusual behavior of birds during eclipses have been told for centuries, but bird reactions were recorded and studied systematically by citizen scientists participating in an eBird project during the total solar eclipse that crossed the USA in 2017 August.  Although some unusual behaviors were observed, many observers noted birds acting like it was dusk and either landing or flying low to the ground.  Radar confirmed a significant decrease in high-flying birds and insects during and just after totality.  Conversely, several sightings of normally nocturnal birds were reported.  Pictured, a flock of birds in La Serena, Chile flew through the air together during the total solar eclipse that crossed South America last week. The photographer captured the scene in frames from an eclipse video.  The next total solar eclipse in 2020 December will also cross South America, while in 2024 April a total solar eclipse will cross North America from Mexico through New England, USA.   Gallery 2019: Notable total eclipse images submitted to APOD";"Birds During a Total Solar Eclipse";"https://apod.nasa.gov/apod/image/1907/BirdsEclipse_Caldas_960.jpg"
111;"2019-07-12";"Irregular galaxy NGC 55 is thought to be similar to the Large Magellanic Cloud (LMC). But while the LMC is about 180,000 light-years away and a well-known satellite of our own Milky Way Galaxy, NGC 55 is more like 6 million light-years distant, a member of the Sculptor Galaxy Group. Classified as an irregular galaxy, in deep exposures the LMC itself resembles a barred disk galaxy. Spanning about 50,000 light-years, NGC 55 is seen nearly edge-on though, presenting a flattened, narrow profile in contrast with our face-on view of the LMC. Just as large star forming regions create emission nebulae in the LMC, NGC 55 is also seen to be producing new stars. This highly detailed galaxy portrait highlights a bright core crossed with dust clouds, telltale pinkish star forming regions, and young blue star clusters in NGC 55.";"Magellanic Galaxy NGC 55";"https://apod.nasa.gov/apod/image/1907/NGC55-LRGB_hager1024.jpg"
112;"2019-07-14";"What's that in the sky? An aurora. A large coronal mass ejection occurred on our Sun five days before this 2012 image was taken, throwing a cloud of fast moving electrons, protons, and ions toward the Earth. Although most of this cloud passed above the Earth, some of it impacted our Earth's magnetosphere and resulted in spectacular auroras being seen at high northern latitudes. Featured here is a particularly photogenic auroral corona captured above Grotfjord, Norway. To some, this shimmering green glow of recombining atmospheric oxygen might appear as a large eagle, but feel free to share what it looks like to you.  Although the Sun is near Solar Minimum, streams of the solar wind continue to impact the Earth and create impressive auroras visible even last week.";"Eagle Aurora over Norway";"https://apod.nasa.gov/apod/image/1610/eagleaurora_jorgensen_900.jpg"
113;"2019-07-19";"On July 20, 1969 the Apollo 11 lunar module Eagle safely touched down on the Moon. It landed near the southwestern corner of the Moon's Mare Tranquillitatis at a landing site dubbed Tranquility Base. This panoramic view of Tranquility Base was constructed from the historic photos taken from the lunar surface. On the far left astronaut Neil Armstrong casts a long shadow with Sun is at his back and the Eagle resting about 60 meters away ( AS11-40-5961). He stands near the rim of 30 meter-diameter Little West crater seen here to the right ( AS11-40-5954). Also visible in the foreground is the top of the camera intended for taking stereo close-ups of the lunar surface.";"Tranquility Base Panorama";"https://apod.nasa.gov/apod/image/1907/apollo11TranquilitybasePan600h.jpg"
114;"2019-07-21";"Why are there so many moonquakes?   Analyses of seismometers left on the moon by the Apollo moon landings reveals a surprising number of moonquakes occurring within 100 kilometers of the surface.   In fact, 62 moonquakes were detected in data recorded between 1972 and 1977.   Many of these moonquakes are not only strong enough to move furniture in a lunar apartment, but the stiff rock of the moon continues to vibrate for many minutes, significantly longer than the softer rock earthquakes on Earth.   The cause of the moonquakes remains unknown, but a leading hypothesis is the collapse of underground faults. Regardless of the source, future moon dwellings need to be built to withstand the frequent shakings.   Pictured here 50 years ago today, Apollo 11 astronaut Buzz Aldrin stands beside a recently deployed lunar seismometer, looking back toward the lunar landing module.";"Moonquakes Surprisingly Common";"https://apod.nasa.gov/apod/image/1907/AldrinSeismometer_Apollo11_960.jpg"
115;"2019-07-23";"Why is the Cigar Galaxy billowing red smoke?  M82, as this starburst galaxy is also known, was stirred up by a recent pass near large spiral galaxy M81.  This doesn't fully explain the source of the red-glowing outwardly expanding gas and dust, however.  Evidence indicates that this gas and dust is being driven out by the combined emerging particle winds of many stars, together creating a galactic superwind.  The dust particles are thought to originate in M82's interstellar medium and are actually similar in size to particles in cigar smoke.  The featured photographic mosaic highlights a specific color of red light strongly emitted by ionized hydrogen gas, showing detailed filaments of this gas and dust.  The filaments extend for over 10,000 light years. The 12-million light-year distant Cigar Galaxy is the brightest galaxy in the sky in infrared light, and can be seen in visible light with a small telescope towards the constellation of the Great Bear (Ursa Major).   APOD in other languages: Arabic, Catalan, Chinese (Beijing), Chinese (Taiwan), Croatian, Czech, Dutch, Farsi, French, French, German, Hebrew, Indonesian, Japanese, Korean, Montenegrin, Polish, Russian, Serbian, Slovenian,  Spanish and Ukrainian";"M82: Galaxy with a Supergalactic Wind";"https://apod.nasa.gov/apod/image/1907/M82_HubbleNobre_960.jpg"
116;"2019-07-24";"What's that strange light down the road? Dust orbiting the Sun. At certain times of the year, a band of sun-reflecting dust from the inner Solar System appears prominently just after sunset -- or just before sunrise -- and is called zodiacal light.  Although the origin of this dust is still being researched, a leading hypothesis holds that zodiacal dust originates mostly from faint Jupiter-family comets and slowly spirals into the Sun. Recent analysis of dust emitted by Comet 67P, visited by ESA's robotic Rosetta spacecraft, bolster this hypothesis.  Pictured when climbing a road up to Teide National Park in the Canary Islands of Spain, a bright triangle of zodiacal light appeared in the distance soon after sunset. Captured on June 21, the scene includes bright Regulus, alpha star of Leo, standing above center toward the left. The Beehive Star Cluster (M44) can be spotted below center, closer to the horizon and also immersed in the zodiacal glow.";"Zodiacal Road";"https://apod.nasa.gov/apod/image/1907/ZodiacalRoad_Merzlyakov_960.jpg"
117;"2019-07-25";"In brush strokes of interstellar dust and glowing hydrogen gas, this beautiful skyscape is painted across the plane of our Milky Way Galaxy near the northern end of the Great Rift and the constellation Cygnus the Swan. Composed with three different telescopes and about 90 hours of image data the widefield mosaic spans an impressive 24 degrees across the sky. Alpha star of Cygnus, bright, hot, supergiant Deneb lies near top center. Crowded with stars and luminous gas clouds Cygnus is also home to the dark, obscuring Northern Coal Sack Nebula, extending from Deneb toward the center of the view. The reddish glow of star forming regions NGC 7000, the North America Nebula and IC 5070, the Pelican Nebula, are just left of Deneb. The Veil Nebula is a standout below and left of center. A supernova remnant, the Veil is some 1,400 light years away, but many other nebulae and star clusters are identifiable throughout the cosmic scene. Of course, Deneb itself is also known to northern hemisphere skygazers for its place in two asterisms -- marking the top of the Northern Cross and a vertex of the Summer Triangle.";"Cygnus Skyscape";"https://apod.nasa.gov/apod/image/1907/CygnusMosaic07192000Symon_1024.jpg"
118;"2019-07-26";"Transfusing sunlight through a still dark sky, this exceptional display of noctilucent clouds was captured earlier this month, reflected in the calm waters of Vallentuna Lake near Stockholm, Sweden. From the edge of space, about 80 kilometers above Earth's surface, the icy clouds themselves still reflect sunlight even though the Sun is below the horizon as seen from the ground. Usually spotted at high latitudes in summer months the night shining clouds have made a strong showing so far during the short northern summer nights. Also known as polar mesopheric clouds they are understood to form as water vapor driven into the cold upper atmosphere condenses on the fine dust particles supplied by disintegrating meteors or volcanic ash. NASA's AIM mission provides daily projections of noctilucent clouds as seen from space.";"The Veins of Heaven";"https://apod.nasa.gov/apod/image/1907/NLCReflectionsAPODheden.jpg"
119;"2019-07-28";"The North America Nebula can do what most North Americans cannot -- form stars.  Precisely where in the nebula these stars are forming has been mostly obscured by some of the nebula's thick dust that is opaque to visible light. However, a view of the North America Nebula in infrared light by the orbiting Spitzer Space Telescope has peered through much of the dust and uncovered thousands of newly formed stars. Rolling your cursor over the above scientifically-colored infrared image will bring up a corresponding optical image of the same region for comparison.  The infrared image neatly captures young stars in many stages of formation, from being imbedded in dense knots of gas and dust, to being surrounded by disks and emitted jets, to being clear of their birth cocoons. The North America Nebula (NGC 7000) spans about 50 light years and lies about 1,500 light years away toward the constellation of the Swan (Cygnus). Still, of all the stars known in the North America Nebula, which massive stars emit the energetic light that gives the ionized  red glow is still debated.";"The North America Nebula in Infrared";"https://apod.nasa.gov/apod/image/1907/northamerica_ir_960.jpg"
121;"2019-07-30";"What's happening in the Statue of Liberty nebula?  Bright stars and interesting molecules are forming and being liberated. The complex nebula resides in the star forming region called RCW 57, and besides the iconic monument, to some looks like a flying superhero or a weeping angel.  By digitally removing the stars, this image showcases dense knots of dark interstellar dust, fields of glowing hydrogen gas ionized by these stars, and great loops of gas expelled by dying stars. A detailed study of NGC 3576, also known as NGC 3582 and NGC 3584, uncovered at least 33 massive stars in the end stages of formation, and the clear presence of the complex carbon molecules known as polycyclic aromatic hydrocarbons (PAHs). PAHs are thought to be created in the cooling gas of star forming regions, and their development in the Sun's formation nebula five billion years ago may have been an important step in the development of life on Earth.   Follow APOD in English on: Instagram, Facebook,  Reddit, or Twitter";"Star Forming Region NGC 3582 without Stars";"https://apod.nasa.gov/apod/image/1907/ngc3576_campbell_960.jpg"
122;"2019-07-31";"To some, this nebula looks like the head of a fish. However, this colorful cosmic portrait really features glowing gas and obscuring dust clouds in IC 1795, a star forming region in the northern constellation Cassiopeia. The nebula's colors were created by adopting the Hubble color palette for mapping narrow emission from oxygen, hydrogen, and sulfur atoms to blue, green and red colors, and further blending the data with images of the region recorded through broadband filters. Not far on the sky from the famous Double Star Cluster in Perseus, IC 1795 is itself located next to IC 1805, the Heart Nebula, as part of a complex of star forming regions that lie at the edge of a large molecular cloud. Located just over 6,000 light-years away, the larger star forming complex sprawls along the Perseus spiral arm of our Milky Way Galaxy. At that distance, this picture would span about 70 light-years across IC 1795.   Astrophysicists: Browse 2,000+ codes in the Astrophysics Source Code Library";"IC 1795: The Fishhead Nebula";"https://apod.nasa.gov/apod/image/1907/FishheadNebula_Pham_960.jpg"
123;"2019-08-01";"Massive stars spend their brief lives furiously burning nuclear fuel. Through fusion at extreme temperatures and densities surrounding the stellar core, nuclei of light elements like Hydrogen and Helium are combined to heavier elements like Carbon, Oxygen, etc. in a progression which ends with Iron. So a supernova explosion, a massive star's inevitable and spectacular demise, blasts back into space debris enriched in heavier elements to be incorporated into other stars and planets and people. This detailed false-color x-ray image from the orbiting Chandra Observatory shows such a hot, expanding stellar debris cloud about 36 light-years across. Cataloged as G292.0+1.8, this young supernova remnant is about 20,000 light-years distant toward the southern constellation Centaurus. Light from the inital supernova explosion reached Earth an estimated 1,600 years ago. Bluish colors highlight filaments of the mulitmillion degree gas which are exceptionally rich in Oxygen, Neon, and Magnesium. This enriching supernova also produced a pulsar in its aftermath, a rotating neutron star remnant of the collapsed stellar core. The stunning image was released as part of the 20th anniversary celebration of the Chandra X-ray Observatory.";"Elements in the Aftermath";"https://apod.nasa.gov/apod/image/1908/g292chandra.jpg"
124;"2019-08-03";"Peering from the shadows, the Saturn-facing hemisphere of Mimas lies in near darkness alongside a dramatic sunlit crescent. The mosaic was captured near the Cassini spacecraft's final close approach on January 30, 2017. Cassini's camera was pointed in a nearly sunward direction only 45,000 kilometers from Mimas. The result is one of the highest resolution views of the icy, crater-pocked, 400 kilometer diameter moon. An enhanced version better reveals the Saturn-facing hemisphere of the synchronously rotating moon lit by sunlight reflected from Saturn itself. To see it, slide your cursor over the image (or follow this link). Other Cassini images of Mimas include the small moon's large and ominous Herschel Crater.";"Mimas in Saturnlight";"https://apod.nasa.gov/apod/image/1908/MimasPIA17213_fig1_1024.jpg"
125;"2019-08-04";"Twenty-one years ago results were first presented indicating that most of the energy in our universe is not in stars or galaxies but is tied to space itself.  In the language of cosmologists, a large cosmological constant -- dark energy -- was directly implied by new distant supernova observations.  Suggestions of a cosmological constant were not new -- they have existed since the advent of modern relativistic cosmology. Such claims were not usually popular with astronomers, though, because dark energy was so unlike known universe components, because dark energy's abundance appeared limited by other observations, and because less-strange cosmologies without a significant amount of dark energy had previously done well in explaining the data. What was exceptional here was the seemingly direct and reliable method of the observations and the good reputations of the scientists conducting the investigations. Over the two decades, independent teams of astronomers have continued to accumulate data that appears to confirm the existence of dark energy and the unsettling result of a presently accelerating universe. In 2011, the team leaders were awarded the Nobel Prize in Physics for their work.  The featured picture of a supernova that occurred in 1994 on the outskirts of a spiral galaxy was taken by one of these collaborations.    News: APOD is now available via Facebook in Hindi.";"Rumors of a Dark Universe";"https://apod.nasa.gov/apod/image/1908/SN1994D_Hubble_960.jpg"
126;"2019-08-05";"If you saw a total solar eclipse, would you do a double-take? One astrophotographer did just that -- but it took a lake and a bit of planning. Realizing that the eclipse would be low on the horizon, he looked for a suitable place along the thin swath of South America that would see, for a few minutes, the Moon completely block the Sun, both directly and in reflection.  The day before totality, he visited an Argentine lake called La Cuesta Del Viento (The Slope of the Wind) and, despite its name, found so little wind that the lake looked like a mirror.  Perfect.  Returning the day of the eclipse, though, there was a strong breeze  churning up the water -- enough to ruin the eclipse reflection shot.  Despair. But wait!  Strangely, about an hour before totality, the wind died down.  This calmness may have been related to the eclipse itself, because eclipsed ground heats the air less and reduces the amount rising warm air -- which can dampen and even change the wind direction.  The eclipse came, his tripod and camera were ready, and so was the lake. The featured image of this double-eclipse came from a single exposure lasting just one fifteenth of a second. Soon after totality, the winds returned and the water again became choppy. No matter -- this double-image of the 2019 July total solar eclipse had been captured forever.";"A Total Solar Eclipse Reflected";"https://apod.nasa.gov/apod/image/1908/DoubleEclipse_Legault_1080.jpg"
127;"2019-08-06";"What does our region of the Universe look like? Since galaxies are so spread out over the sky, and since our Milky Way Galaxy blocks part of the distant sky, it has been hard to tell. A new map has been made, however, using large-scale galaxy motions to infer what massive objects must be gravitating in the nearby universe. The featured map, spanning over 600 million light years on a side, shows that our Milky Way Galaxy is on the edge of the Virgo Cluster of Galaxies, which is connected to the Great Attractor -- an even larger grouping of galaxies. Also nearby are the massive Coma Cluster and the extensive Perseus-Pisces Supercluster. Conversely, we are also on the edge of huge region nearly empty of galaxies known as the Local Void.  The repulsive push by the Local Void combined with the gravitational pull toward the elevated galaxy density on the other side of the sky explains part of the mysteriously high speed our Galaxy has relative to the cosmic microwave background -- but not all.  To explore the local universe yourself, as determined by Cosmicflows-3, you are invited to zoom in and spin around this interactive 3D visualization.";"The Local Void in the Nearby Universe";"https://apod.nasa.gov/apod/image/1908/VoidMap_Tully_960.jpg"
128;"2019-08-08";"Part of a 360 degree panorama, this view looks out from the Mars rover Curiosity's current location on the Red Planet dubbed Teal Ridge. The mosaicked scene was captured by the rover's Mastcam on Earth calendar date June 18, 2019. That corresponds to Curiosity's sol 2440, or 2,440th martian day on the surface. Since landing seven years ago on August 6, 2012 in Gale Crater, Curiosity has traveled some 21 kilometers (13 miles). On the right, the rover's tracks lead back toward Vera Rubin Ridge with the Gale Crater rim visible in the distance. The robotic rover leaves wheel tracks about 3 meters (10 feet) apart. During its mission, Curiosity has had great successes exploring the history of water in the martian environment. In fact, NASA's Mars 2020 rover is largely based on the Mars Curiosity rover design.   Watch: Perseid Meteor Shower";"Curiosity at Teal Ridge";"https://apod.nasa.gov/apod/image/1908/pia23346-16_1024.jpg"
129;"2019-08-09";"This single, 251-second long exposure follows the early flight of an Atlas V rocket on August 8, streaking eastward toward the dawn from Cape Canaveral Air Force Station, planet Earth. The launch of the United Launch Alliance rocket was at 6:13am local time. Sunrise was not until 6:48am, but the rocket's downrange plume at altitude is brightly lit by the Sun still just below the eastern horizon. Waters of the Indian River Lagoon in Palm Shores, Forida reflect subtle colors and warming glow of the otherwise calm, predawn sky. The mighty Atlas rocket carried a military communications satellite into Earth orbit. Of course, this weekend the streaks you see in clear skies before the dawn could be Perseid Meteors.   Watch: Perseid Meteor Shower";"Atlas at Dawn";"https://apod.nasa.gov/apod/image/1908/5D4_5485seeley_1067.jpg"
