"id";"date";"explanation";"title";"link"
1;"2019-01-02";"The Great Nebula in Orion is an intriguing place.  Visible to the unaided eye, it appears as a small fuzzy patch in the constellation of Orion. But this image, an illusory-color four-panel mosaic taken in different bands of infrared light with the Earth orbiting WISE observatory, shows the Orion Nebula to be a bustling  neighborhood of recently formed stars, hot gas, and dark dust.  The power behind much of the Orion Nebula (M42) is the stars of the Trapezium star cluster, seen near the center of the featured image. The orange glow surrounding the bright stars pictured here is their own starlight reflected by intricate dust filaments that cover much of the region.  The current  Orion Nebula cloud complex, which includes the Horsehead Nebula, will slowly disperse over the next 100,000 years.   News: New Horizons Results from Ultima Thule";"The Orion Nebula in Infrared from WISE";"https://apod.nasa.gov/apod/image/1901/orionred_WISEantonucci_960.jpg"
2;"2019-01-04";"Ultima Thule is the most distant world explored by a spacecraft from Earth. In the dim light 6.5 billion kilometers from the Sun, the New Horizons spacecraft captured these two frames 38 minutes apart as it sped toward the Kuiper belt world on January 1 at 51,000 kilometers per hour. A contact binary, the two lobes of Ultima Thule rotate together once every 15 hours or so. Shown as a blinking gif, the rotation between the frames produces a tantalizing 3D perspective of the most primitive world ever seen. Dubbed separately by the science team Ultima and Thule, the larger lobe Ultima, is about 19 kilometers in diameter. Smaller Thule is 14 kilometers across.";"Ultima Thule Rotation Gif";"https://apod.nasa.gov/apod/image/1901/UT-blink_3d_a.gif"
3;"2019-01-06";"Why are these people shooting a powerful laser into the center of our Galaxy?  Fortunately, this is not meant to be the first step in a Galactic war.  Rather, astronomers at the Very Large Telescope (VLT) site in Chile are trying to measure the distortions of Earth's ever changing atmosphere.  Constant imaging of high-altitude atoms excited by the laser -- which appear like an artificial star -- allow astronomers to instantly measure atmospheric blurring.  This information is fed back to a VLT telescope mirror which is then slightly deformed to minimize this blurring.  In this case, a VLT was observing our Galaxy's center, and so Earth's atmospheric blurring in that direction was needed.  As for inter-galaxy warfare, when viewed from our Galaxy's center, no casualties are expected.  In fact, the light from this powerful laser would combine with light from our Sun to together appear only as bright as a faint and distant star.    APOD in other languages: Arabic, Catalan, Chinese (Beijing), Chinese (Taiwan), Croatian, Czech, Dutch, German, French, French, Hebrew, Indonesian, Japanese, Korean, Montenegrin, Polish, Russian, Serbian, Slovenian and Spanish";"A Laser Strike at the Galactic Center";"https://apod.nasa.gov/apod/image/1901/vltlaser_beletsky_960.jpg"
5;"2019-01-09";"Named for a forgotten constellation, the Quadrantid Meteor Shower is an annual event for planet Earth's northern hemisphere skygazers It usually peaks briefly in the cold, early morning hours of January 4. The shower's radiant on the sky lies within the old, astronomically obsolete constellation Quadrans Muralis. That position is situated near the boundaries of the modern constellations Hercules, Bootes, and Draco. About 30 Quadrantid meteors can be counted in this skyscape composed of digital frames recorded in dark and moonless skies between 2:30am and local dawn. The shower's radiant is rising just to the right of the Canary Island of Tenerife's Teide volcano, and just below the familiar stars of the Big Dipper on the northern sky. A likely source of the dust stream that produces Quadrantid meteors was identified in 2003 as an asteroid. Look carefully and you can also spot a small, telltale greenish coma above the volcanic peak and near the top of the frame. That's the 2018 Christmas visitor to planet Earth's skies, Comet Wirtanen.";"Quadrantids";"https://apod.nasa.gov/apod/image/1901/Cuadrantidas30estelasDLopez1024.jpg"
6;"2019-01-10";"The plane of our Milky Way Galaxy runs through this complex and beautiful skyscape. Seen toward colorful stars near the northwestern edge of the constellation Vela (the Sails), the 16 degree wide, 200 frame mosaic is centered on the glowing filaments of the Vela Supernova Remnant, the expanding debris cloud from the death explosion of a massive star. Light from the supernova explosion that created the Vela remnant reached Earth about 11,000 years ago. In addition to the shocked filaments of glowing gas, the cosmic catastrophe also left behind an incredibly dense, rotating stellar core, the Vela Pulsar. Some 800 light-years distant, the Vela remnant is likely embedded in a larger and older supernova remnant, the Gum Nebula. Objects identified in this broad mosaic include emission and reflection nebulae, star clusters, and the remarkable Pencil Nebula.";"Vela Supernova Remnant Mosaic";"https://apod.nasa.gov/apod/image/1901/Vela-DSS-New-SS1024.jpg"
7;"2019-01-12";"It can be the driest place on planet Earth, but water still flows in Chile's Atacama desert, high in the mountains. After discovering this small creek with running water, the photographer returned to the site to watch the Milky Way rise in the dark southern skies, calculating the moment when Milky Way and precious flowing water would meet. In the panoramic night skyscape, stars and nebulae immersed in the glow along the Milky Way itself also shared that moment with the Milky Way's satellite galaxies the Large and Small Magellanic clouds above the horizon at the right. Bright star Beta Centauri is poised at the very top of the waterfall. Above it lies the dark expanse of the Coalsack nebula and the stars of the Southern Cross.";"Milky Way Falls";"https://apod.nasa.gov/apod/image/1901/beletsky_waterfall900.jpg"
8;"2019-01-15";"Is the heart and soul of our Galaxy located in Cassiopeia?  Possibly not, but that is where two bright emission nebulas nicknamed Heart and Soul can be found.  The Heart Nebula, officially dubbed IC 1805 and visible in the featured image on the bottom right, has a shape reminiscent of a classical heart symbol.  The Soul Nebula is officially designated IC 1871 and is visible on the upper left. Both nebulas shine brightly in the red light of energized hydrogen. Also shown in this three-color montage is light emitted from sulfur, shown in yellow, and oxygen, shown in blue.  Several young open clusters of stars are visible near the nebula centers.  Light takes about 6,000 years to reach us from these nebulas, which together span roughly 300 light years.  Studies of stars and clusters like those found in the Heart and Soul Nebulas have focused on how massive stars form and how they affect their environment.   Follow APOD on: Instagram, Facebook,  Reddit, or Twitter";"The Heart and Soul Nebulas";"https://apod.nasa.gov/apod/image/1901/HeartSoul_Zauner_960.jpg"
9;"2019-01-17";"Gocka's, a family nickname for the mountain cabin, and a wooden sled from a generation past stand quietly under the stars. The single exposure image was taken on January 6 from Tanndalen Sweden to evoke a simple visual experience of the dark mountain skies. A pale band of starlight along the Milky Way sweeps through the scene. At the foot of Orion the Hunter, bright star Rigel shines just above the old kicksled's handrail. Capella, alpha star of Auriga the celestial charioteer, is the brightest star at the top of the frame. In fact, the familiar stars of the winter hexagon and the Pleiades star cluster can all be found in this beautiful skyscape from a northern winter night.";"Cabin under the Stars";"https://apod.nasa.gov/apod/image/1901/KicksledTWAN20190106.jpg"
10;"2019-01-19";"The Moon slid through Earth's shadow on January 31, 2018 in a total lunar eclipse. In this time-lapse sequence of that eclipse from Portal, Arizona, USA, the partial eclipse starts with the Moon high in the western sky. The eclipse total phase lasted about 76 minutes, but totality ended after the dark, reddened Moon set below the horizon. The upcoming total lunar eclipse, on the night of January 20/21, will be better placed for skygazers across the Americas, though. There, all 62 minutes of the total phase, when the Moon is completely immersed in Earth's dark umbral shadow, will take place with the Moon above the horizon. Watch it if you can. The next total lunar eclipse visible from anywhere on planet Earth won't take place until May 26, 2021, and then the total eclipse will last a mere 15 minutes.";"Total Lunar Eclipse at Moonset";"https://apod.nasa.gov/apod/image/1901/TLE2018Jan-seq3w.jpg"
11;"2019-01-21";"This is what NASA's Insight lander looks like on Mars. With its solar panels, InSight is about the size of a small bus.  Insight successfully landed on Mars in November with a main objective to detect seismic activity. The featured selfie is a compilation of several images taken of different parts of the InSight lander, by the lander's arm, at different times. SEIS, the orange-domed seismometer seen near the image center last month, has now been placed on the Martian surface.  With this selfie, Mars InSight continues  a long tradition of robotic spacecraft on Mars taking and returning images of themselves, including Viking, Sojourner, Pathfinder, Spirit, Opportunity, Phoenix, and Curiosity.  Data taken by Mars Insight is expected to give humanity unprecedented data involving the interior of Mars, a region thought to harbor formation clues not only about Mars, but Earth.    Growing Gallery:  Last Night's Total Lunar Eclipse";"InSight Lander Takes Selfie on Mars";"https://apod.nasa.gov/apod/image/1901/Selfie_InSight_1080.jpg"
12;"2019-01-22";"Why would a bright full Moon suddenly become dark?  Because it entered the shadow of the Earth.  That's what happened Sunday night as the Moon underwent a total lunar eclipse.  Dubbed by some as a Super (because the Moon was angularly larger than usual, at least slightly) Blood (because the scattering of sunlight through the Earth's atmosphere makes an eclipsed Moon appeared unusually red) Wolf (because January full moons are sometimes called Wolf Moons from the legend that wolves like to howl at the moon) Moon Eclipse, the shadowy spectacle was visible from the half of the Earth then facing the Moon, and was captured in numerous spectacular photographs.  Featured, a notable image sequence was captured over the Cologne Cathedral, a UNESCO World Heritage Site, in Cologne, Germany. The lunar eclipse sequence was composed from 68 different exposures captured over three hours during freezing temperatures -- and later digitally combined and edited to remove a cyclist and a pedestrian.  The next total lunar eclipse will occur in 2021.    Gallery:  Sunday Night's Total Lunar Eclipse";"Lunar Eclipse over Cologne Cathedral";"https://apod.nasa.gov/apod/image/1901/LunarEclipseCologne_Junius_960.jpg"
13;"2019-01-23";"Do you recognize this constellation? Through the icicles and past the mountains is Orion, one of the most identifiable star groupings on the sky and an icon familiar to humanity for over 30,000 years. Orion has looked pretty much the same during the past 50,000 years and should continue to look the same for many thousands of years into the future.  Orion is quite prominent in the sky this time of year, a recurring sign of (modern) winter in Earth's northern hemisphere and summer in the south. Pictured, Orion was captured recently above the Austrian Alps in a composite of seven images taken by the same camera in the same location during the same night. Below and slightly to the right of Orion's three-star belt is the Orion Nebula, while the four bright stars surrounding the belt are, clockwise from the upper left, Betelgeuse, Bellatrix, Rigel, and Saiph.    New: Instagram page features cool images recently submitted to APOD";"Orion over the Austrian Alps";"https://apod.nasa.gov/apod/image/1901/OrionAlps_Vesely_960.jpg"
14;"2019-01-24";"Fans of planet Earth probably recognize the Matterhorn in the foreground of this night skyscape. Famed in mountaineering history, the 4,478 meter Alpine mountain stands next to the totally eclipsed Moon. In spite of -22 degree C temperatures, the inspired scene was captured on the morning of January 21 from the mountains near Zermatt, Switzerland. Different exposures record the dim red light reflected by the Moon fully immersed in Earth's shadow. Seen directly above the famous Alpine peak, but about 600 light-years away, are the stars of the Praesepe or Beehive star cluster also known as Messier 44. An added reward to the cold eclipse vigil, a bright and colorful meteor flashed below the temporarily dimmmed Moon, just tracing the Matterhorn's north-eastern climbing route along Hornli ridge.";"Matterhorn, Moon, and Meteor";"https://apod.nasa.gov/apod/image/1901/cervin1300vetter.jpg"
15;"2019-01-25";"Craters produced by ancient impacts on the airless Moon have long been a familiar sight. But only since the 1990s have observers began to regularly record and study optical flashes on the lunar surface, likely explosions resulting from impacting meteoroids. Of course, the flashes are difficult to see against a bright, sunlit lunar surface. But during the January 21 total eclipse many imagers serendipitously captured a meteoroid impact flash against the dim red Moon. Found while examining images taken shortly before the total eclipse phase began, the flash is indicated in the inset above, near the Moon's darkened western limb. Estimates based on the flash duration recorded by the Moon Impact Detection and Analysis System (MIDAS) telescopes in southern Spain indicate the impactor's mass was about 10 kilograms and created a crater between seven and ten meters in diameter.";"Moon Struck";"https://apod.nasa.gov/apod/image/1901/2019_01_21_ZM_Single_crop1024.jpg"
16;"2019-01-26";"The dark, inner shadow of planet Earth is called the umbra. Shaped like a cone extending into space, it has a circular cross section most easily seen during a lunar eclipse. For example, on January 21 the Full Moon slid across the northern half of Earth's umbral shadow, entertaining moonwatchers around much of the planet. In the total phase of the eclipse, the Moon was completely within the umbra for 63 minutes. Recorded under clear, dark skies from the hills near Chiuduno, Italy this composite eclipse image uses successive pictures from totality (center) and partial phases to trace out a large part of the umbra's curved edge. Reflecting sunlight scattered by the atmosphere into Earth's shadow, the lunar surface appears reddened during totality. But close to the umbra's edge, the limb of the eclipsed Moon shows a distinct blue hue. The blue eclipsed moonlight originates as rays of sunlight pass through layers high in the upper stratosphere, colored by ozone that scatters red light and transmits blue.";"The Umbra of Earth";"https://apod.nasa.gov/apod/image/1901/LOmbradellaTerraFinazzi1024.jpg"
17;"2019-01-27";"There is a road that connects the Northern to the Southern Cross but you have to be at the right place and time to see it. The road, as pictured here, is actually the central band of our Milky Way Galaxy; the right place, in this case, is dark Laguna Cejar in Salar de Atacama of Northern Chile; and the right time was in early October, just after sunset. Many sky wonders were captured then, including the bright Moon, inside the Milky Way arch;  Venus, just above the Moon; Saturn and Mercury, just below the Moon; the Large and Small Magellanic Clouds satellite galaxies, on the far left; red airglow near the horizon on the image left; and the lights of small towns at several locations across the horizon.  One might guess that composing this 30-image panorama would have been a serene experience, but for that one would have required earplugs to ignore the continued brays of wild donkeys.";"From the Northern to the Southern Cross";"https://apod.nasa.gov/apod/image/1901/chilepan_buer_1400.jpg"
18;"2019-01-28";"Why is there long red streak attached to this galaxy?  The streak is made mostly of glowing hydrogen that has been systematically stripped away as the galaxy moved through the ambient hot gas in a cluster of galaxies.  Specifically, the galaxy is spiral galaxy D100, and cluster is the Coma Cluster of galaxies.  The red path connects to the center of D100 because the outer gas, gravitationally held less strongly, has already been stripped away by ram pressure. The extended gas tail is about 200,000 light-years long, contains about 400,000 times the mass of our Sun, and stars are forming within it.  Galaxy D99, visible to D100's lower left, appears red because it glows primarily from the light of old red stars -- young blue stars can no longer form because D99 has been stripped of its star-forming gas. The featured false-color picture is a digitally enhanced composite of images from Earth-orbiting Hubble and the ground-based Subaru telescope. Studying remarkable systems like this bolsters our understanding of how galaxies evolve in clusters.";"The Long Gas Tail of Spiral Galaxy D100";"https://apod.nasa.gov/apod/image/1901/D100gas_HubbleSubaru_960.jpg"
19;"2019-01-30";"Only in the fleeting darkness of a total solar eclipse is the light of the solar corona easily visible. Normally overwhelmed by the bright solar disk, the expansive corona, the sun's outer atmosphere, is an alluring sight. But the subtle details and extreme ranges in the corona's brightness, although discernible to the eye, are notoriously difficult to photograph. Pictured here, however, using over 120 images and meticulous digital processing, is a detailed wide-angle image of the Sun's corona taken during the Great American Eclipse in 2017 August.  Clearly visible are intricate layers and glowing caustics of an ever changing mixture of hot gas and magnetic fields. Hundreds of stars as faint as 11th magnitude are visible behind the Moon and Sun, with Mars appearing in red on the far right.  The next total eclipse of the Sun will occur on July 2 and be visible during sunset from a thin swath across Chile and Argentina.";"Wide Field View of Great American Eclipse";"https://apod.nasa.gov/apod/image/1901/AmEclipseWide_Lefaudeux_1080.jpg"
20;"2019-01-31";"Blown by fast winds from a hot, massive star, this cosmic bubble is huge. Cataloged as Sharpless 2-308 it lies some 5,200 light-years away toward the constellation of the Big Dog (Canis Major) and covers slightly more of the sky than a Full Moon. That corresponds to a diameter of 60 light-years at its estimated distance. The massive star that created the bubble, a Wolf-Rayet star, is the bright one near the center of the nebula. Wolf-Rayet stars have over 20 times the mass of the Sun and are thought to be in a brief, pre-supernova phase of massive star evolution. Fast winds from this Wolf-Rayet star create the bubble-shaped nebula as they sweep up slower moving material from an earlier phase of evolution. The windblown nebula has an age of about 70,000 years. Relatively faint emission captured in the expansive image is dominated by the glow of ionized oxygen atoms mapped to a blue hue. SH2-308 is also known as The Dolphin Nebula.";"Sharpless 308: Star Bubble";"https://apod.nasa.gov/apod/image/1901/SH2-308Laubing1024.jpg"
21;"2019-02-01";"Spiral galaxy pair NGC 4567 and NGC 4568 share this sharp cosmic vista with lonely elliptical galaxy NGC 4564. All are members of the large Virgo Galaxy Cluster. With their classic spiral arms, dust lanes, and star clusters, the eye-catching spiral pair is also known as the Butterfly Galaxies or the Siamese Twins. Very close together, the galaxy twins don't seem to be too distorted by gravitational tides. Their giant molecular clouds are known to be colliding though and are likely fueling the formation of massive star clusters. The galaxy twins are about 52 million light-years distant, while their bright cores appear separated by about 20,000 light-years. Of course, the spiky foreground stars lie within our own Milky Way.";"Twin Galaxies in Virgo";"https://apod.nasa.gov/apod/image/1902/NGC4567_70chart32_1024.jpg"
22;"2019-02-03";"Why would the sky look like a giant fan? Airglow. The featured intermittent green glow appeared to rise from a lake through the arch of our Milky Way Galaxy, as captured during 2015 next to Bryce Canyon in Utah, USA.  The unusual pattern was created by atmospheric gravity waves, ripples of alternating air pressure that can grow with height as the air thins, in this case about 90 kilometers up.  Unlike auroras powered by collisions with energetic charged particles and seen at high latitudes, airglow is due to chemiluminescence, the production of light in a chemical reaction.  More typically seen near the horizon, airglow keeps the night sky from ever being completely dark.   Follow APOD on: Instagram, Facebook,  Reddit, or Twitter";"An Airglow Fan from Lake to Sky";"https://apod.nasa.gov/apod/image/1601/AirglowFan_Lane_960.jpg"
23;"2019-02-04";"Massive stars profoundly affect their galactic environments.  Churning and mixing interstellar clouds of gas and dust, stars -- most notably those upwards of tens of times the mass of our Sun -- leave their mark on the compositions and locations of future generations of stars.  Dramatic evidence of this is illustrated in our neighboring galaxy, the Large Magellanic Cloud (LMC), by the featured nebula, Henize 70 (also known as N70 and DEM301).  Henize 70 is actually a luminous superbubble of interstellar gas about 300 light-years in diameter, blown by winds from hot, massive stars and supernova explosions, with its interior filled with tenuous hot and expanding gas.  Because superbubbles can expand through an entire galaxy, they offer humanity a chance to explore the connection between the lifecycles of stars and the evolution of galaxies.";"Henize 70: A Superbubble in the LMC";"https://apod.nasa.gov/apod/image/1902/N70_Durdis_960.jpg"
24;"2019-02-07";"Clouds of glowing hydrogen gas fill this colorful skyscape in the faint but fanciful constellation Monoceros, the Unicorn. A star forming region cataloged as NGC 2264, the complex jumble of cosmic gas and dust is about 2,700 light-years distant and mixes reddish emission nebulae excited by energetic light from newborn stars with dark interstellar dust clouds. Where the otherwise obscuring dust clouds lie close to the hot, young stars they also reflect starlight, forming blue reflection nebulae. The telescopic image spans about 3/4 degree or nearly 1.5 full moons, covering 40 light-years at the distance of NGC 2264. Its cast of cosmic characters includes the the Fox Fur Nebula, whose dusty, convoluted pelt lies near the top, bright variable star S Monocerotis immersed in the blue-tinted haze near center, and the Cone Nebula pointing in from the right side of the frame. Of course, the stars of NGC 2264 are also known as the Christmas Tree star cluster. The triangular tree shape is seen on its side here. Traced by brighter stars it has its apex at the Cone Nebula. The tree's broader base is centered near S Monocerotis.";"Fox Fur, Unicorn, and Christmas Tree";"https://apod.nasa.gov/apod/image/1902/FoxFur_25percent.jpg"
25;"2019-02-08";"A luminous Milky Way falls toward the horizon in this deep skyscape, starting at the top of the frame from the stars of the Southern Cross and the dark Coalsack Nebula.  Captured in the dark predawn of February 2nd from Central Victoria, Australia, planet Earth, the 26 day old waning crescent Moon still shines brightly near the horizon. The second and third brightest celestial beacons are Venus and Jupiter along the lower part of the Milky Way's central bulge. Almost in line with the brighter planets and Moon, Saturn is the pinprick of light just visible below and right of the lunar glow. Australia's first astronomers saw the elongated, bulging shape of the familiar Milky Way as a great celestial Emu. The Moon and planets could almost be the Emu's eggs on this starry night.";"Moon, Four Planets, and Emu";"https://apod.nasa.gov/apod/image/1902/ACherney_MoonPlanets800.jpg"
26;"2019-02-12";"No, this is not a good way to get to the Moon. What is pictured is a chance superposition of an airplane and the Moon. The contrail would normally appear white, but the large volume of air toward the setting Sun preferentially knocks away blue light, giving the reflected trail a bright red hue.  Far in the distance, well behind the plane, is a crescent Moon, also slightly reddened.  Captured a month ago above Valais, Switzerland, the featured image was taken so soon after sunset that planes in the sky were still in sunlight, as were their contrails. Within minutes, unfortunately, the impromptu sky show ended.  The plane crossed the Moon and moved out of sight.  The Moon set.  The contrail became unilluminated and then dispersed.";"Plane Crossing a Crescent Moon";"https://apod.nasa.gov/apod/image/1902/PlaneTrailMoon_Staiger_960.jpg"
