"id";"date";"explanation";"title";"link"
130;"2019-08-10";"A star cluster around 2 million years young surrounded by natal clouds of dust and glowing gas, M16 is also known as The Eagle Nebula. This beautifully detailed image of the region adopts the colorful Hubble palette and includes cosmic sculptures made famous in Hubble Space Telescope close-ups of the starforming complex. Described as elephant trunks or Pillars of Creation, dense, dusty columns rising near the center are light-years in length but are gravitationally contracting to form stars. Energetic radiation from the cluster stars erodes material near the tips, eventually exposing the embedded new stars. Extending from the ridge of bright emission left of center is another dusty starforming column known as the Fairy of Eagle Nebula. M16 lies about 7,000 light-years away, an easy target for binoculars or small telescopes in a nebula rich part of the sky toward the split constellation Serpens Cauda (the tail of the snake).   Watch: Perseid Meteor Shower";"M16 Close Up";"https://apod.nasa.gov/apod/image/1908/M16_HSHO_crop2_1024.jpg"
131;"2019-08-11";"This dance is to the death.  Along the way, as these two large galaxies duel, a cosmic bridge of stars, gas, and dust currently stretches over 75,000 light-years and joins them.  The bridge itself is strong evidence that these two immense star systems have passed close to each other and experienced violent tides induced by mutual gravity. As further evidence, the face-on spiral galaxy on the right, also known as NGC 3808A, exhibits many young blue star clusters produced in a burst of star formation. The twisted edge-on spiral on the left (NGC 3808B) seems to be wrapped in the material bridging the galaxies and surrounded by a curious polar ring. Together, the system is known as Arp 87 and morphologically classified, technically, as peculiar. While such interactions are drawn out over billions of years, repeated close passages should ultimately result in the death of one galaxy in the sense that only one galaxy will eventually result. Although this scenario does look peculiar, galactic mergers are thought to be common, with Arp 87 representing a stage in this inevitable process. The Arp 87 pair are about 300 million light-years distant toward the constellation Leo. The prominent edge-on spiral galaxy at the far left appears to be a more distant background galaxy and not involved in the on-going merger.";"Arp 87: Merging Galaxies from Hubble";"https://apod.nasa.gov/apod/image/1908/Arp87_Hubble_1080.jpg"
132;"2019-08-12";"Tonight is a good night to see meteors.  Comet dust will rain down on planet Earth, streaking through dark skies during the peak of the annual Perseid Meteor Shower.  The featured composite image was taken during last year's Perseids from the Poloniny Dark Sky Park in Slovakia.  The unusual building in the foreground is a planetarium on the grounds of Kolonica Observatory. Although the comet dust particles travel parallel to each other, the resulting shower meteors clearly seem to radiate from a single point on the sky in the eponymous constellation Perseus.  The radiant effect is due to perspective, as the parallel tracks appear to converge at a distance, like train tracks.  The Perseid Meteor Shower is expected to peak after midnight tonight, although unfortunately this year the sky will be brightened by a near full Moon.";"Perseid Meteors over Slovakia";"https://apod.nasa.gov/apod/image/1908/PerseidsSlovakia_Horalek_960.jpg"
133;"2019-08-15";"Despite interfering moonlight, many denizens of planet Earth were able to watch this year's Perseid meteor shower. This pastoral scene includes local skygazers admiring the shower's brief, heavenly flashes in predawn hours near peak activity on August 13 from Nalati Grassland in Xinjiang, China. A composite, the image registers seven frames taken during a two hour span recording Perseid meteor streaks against a starry sky. Centered along the horizon is the Plough, the north's most famous asterism, though some might see the familiar celestial kitchen utensil known as the Big Dipper. Perhaps the year's most easily enjoyed meteor shower, Perseid meteors are produced as Earth itself sweeps through dust from periodic comet Swift-Tuttle. The dust particles are vaporized at altitudes of 100 kilometers or so as they plow through the atmosphere at 60 kilometers per second.";"The Perseids and the Plough";"https://apod.nasa.gov/apod/image/1908/PerseidsPloughCow1024.jpg"
134;"2019-08-16";"Like an illustration in a galactic Just So Story, the Elephant's Trunk Nebula winds through the emission nebula and young star cluster complex IC 1396, in the high and far off constellation of Cepheus. Also known as vdB 142, the cosmic elephant's trunk is over 20 light-years long. This colorful close-up view was recorded through narrow band filters that transmit the light from ionized hydrogen, sulfur, and oxygen atoms in the region.  The resulting composite highlights the bright swept-back ridges that outline pockets of cool interstellar dust and gas. Such embedded, dark, tendril-shaped clouds contain the raw material for star formation and hide protostars within. Nearly 3,000 light-years distant, the relatively faint IC 1396 complex covers a large region on the sky, spanning over 5 degrees. The dramatic scene spans a 1 degree wide field, about the size of 2 Full Moons.";"The Elephant's Trunk Nebula in Cepheus";"https://apod.nasa.gov/apod/image/1908/ElephantTrunk_Ayoub1024.jpg"
135;"2019-08-17";"By the turn of the 20th century advances in photography contributed an important tool for astronomers. Improving photographic materials, long exposures, and new telescope designs produced astronomical images with details not visible at the telescopic eyepiece alone. Remarkably recognizable to astrophotographers today, this stunning image of the star forming Orion Nebula was captured in 1901 by American astronomer and telescope designer George Ritchey. The original glass photographic plate, sensitive to green and blue wavelengths, has been digitized and light-to-dark inverted to produce a positive image. His hand written notes indicate a 50 minute long exposure that ended at dawn and a reflecting telescope aperture of 24 inches masked to 18 inches to improve the sharpness of the recorded image. Ritchey's plates from over a hundred years ago preserve astronomical data and can still be used for exploring astrophysical processes.";"1901 Photograph: The Orion Nebula";"https://apod.nasa.gov/apod/image/1908/orion1901_ritchey1024.jpg"
136;"2019-08-18";"You are a spaceship soaring through the universe. So is your dog. We all carry with us trillions of microorganisms as we go through life. These multitudes of bacteria, fungi, and archaea have different DNA than you. Collectively called your microbiome, your shipmates outnumber your own cells. Your crew members form communities, help digest food, engage in battles against intruders, and sometimes commute on a liquid superhighway from one end of your body to the other.  Much of what your microbiome does, however, remains unknown. You are the captain, but being nice to your crew may allow you to explore more of your local cosmos.";"Human as Spaceship";"https://apod.nasa.gov/apod/image/1908/HumanSpaceship2_TsevisHubbleRJN_960.jpg"
137;"2019-08-22";"Large spiral galaxy NGC 4945 is seen edge-on near the center of this cosmic galaxy portrait. In fact, it's almost the size of our Milky Way Galaxy. NGC 4945's own dusty disk, young blue star clusters, and pink star forming regions standout in the sharp, colorful telescopic image. About 13 million light-years distant toward the expansive southern constellation Centaurus, NGC 4945 is only about six times farther away than Andromeda, the nearest large spiral galaxy to the Milky Way. Though this galaxy's central region is largely hidden from view for optical telescopes, X-ray and infrared observations indicate significant high energy emission and star formation in the core of NGC 4945. Its obscured but active nucleus qualifies the gorgeous island universe as a Seyfert galaxy and home to a central supermassive black hole.";"Nearby Spiral Galaxy NGC 4945";"https://apod.nasa.gov/apod/image/1908/NGC4945_HaLRGB.jpg"
138;"2019-08-23";"Drifting through the Orion Arm of the spiral Milky Way Galaxy, this cosmic cloud by chance echoes the outline of California on the west coast of the United States. Our own Sun also lies within the Milky Way's Orion Arm, only about 1,500 light-years from the California Nebula. Also known as NGC 1499, the classic emission nebula is around 100 light-years long. The California Nebula shines with the telltale reddish glow characteristic of hydrogen atoms recombining with long lost electrons. The electrons have been stripped away, ionized by energetic starlight. Most likely providing the energetic starlight that ionizes much of the nebular gas is the bright, hot, bluish star Xi Persei just to the right of the nebula.  A popular target for astrophotographers, this deep California Nebula image is a 6 panel telecopic mosaic and covers a wide field of view. The nebula lies toward the constellation Perseus, not far from the Pleiades.";"NGC 1499: The California Nebula";"https://apod.nasa.gov/apod/image/1908/NGC1499_mosaic1024.jpg"
139;"2019-08-24";"Globular star cluster Omega Centauri, also known as NGC 5139, is some 15,000 light-years away. The cluster is packed with about 10 million stars much older than the Sun within a volume about 150 light-years in diameter. It's the largest and brightest of 200 or so known globular clusters that roam the halo of our Milky Way galaxy. Though most star clusters consist of stars with the same age and composition, the enigmatic Omega Cen exhibits the presence of different stellar populations with a spread of ages and chemical abundances. In fact, Omega Cen may be the remnant core of a small galaxy merging with the Milky Way.";"Millions of Stars in Omega Centauri";"https://apod.nasa.gov/apod/image/1908/OmegaCentauriMillerWalker1024.jpg"
140;"2019-08-27";"Why is the sky near Antares and Rho Ophiuchi so dusty yet colorful?  The colors result from a mixture of objects and processes.  Fine dust illuminated from the front by starlight produces blue reflection nebulae. Gaseous clouds whose atoms are excited by ultraviolet starlight produce reddish emission nebulae. Backlit dust clouds block starlight and so appear dark.   Antares, a red supergiant and one of the brighter stars in the night sky, lights up the yellow-red clouds on the lower left of the featured image. Rho Ophiuchi lies at the center of the blue nebula near the top.   The distant globular cluster M4 is visible to the right of Antares. These star clouds are even more colorful than humans can see, emitting light across the electromagnetic spectrum.";"Dark Dust and Colorful Clouds near Antares";"https://apod.nasa.gov/apod/image/1908/AntaresRho_McGarvey_960.jpg"
141;"2019-08-28";"Image data from the Hubble Space Telescope, the European Southern Observatory, and small telescopes on planet Earth are combined in this magnificent portrait of face-on spiral galaxy Messier 61 (M61). A mere 55 million light-years away in the Virgo Cluster of Galaxies, M61 is also known as NGC 4303. It's considered to be an example of a barred spiral galaxy similar to our own Milky Way. Like other spiral galaxies, M61 also features sweeping spiral arms, cosmic dust lanes, pinkish star forming regions, and young blue star clusters. The bright galactic core is offset to the left in this 50 thousand light-year wide close-up.";"Messier 61 Close Up";"https://apod.nasa.gov/apod/image/1908/M61-HST-ESO-S1024.jpg"
142;"2019-09-01";"Have you ever seen the Pleiades star cluster? Even if you have, you probably have never seen it as dusty as this. Perhaps the most famous star cluster on the sky, the bright stars of the Pleiades can be seen without binoculars from even the depths of a light-polluted city.  With a long exposure from a dark location, though, the dust cloud surrounding the Pleiades star cluster becomes very evident. The featured exposure took over 12 hours and covers a sky area several times the size of the full moon.  Also known as the Seven Sisters and M45, the Pleiades lies about 400 light years away toward the constellation of the Bull (Taurus).  A common legend with a modern twist is that one of the brighter stars faded since the cluster was named, leaving only six stars visible to the unaided eye. The actual number of Pleiades stars visible, however, may be more or less than seven, depending on the darkness of the surrounding sky and the clarity of the observer's eyesight.";"M45: The Pleiades Star Cluster";"https://apod.nasa.gov/apod/image/1909/m45_lorenzi_960.jpg"
143;"2019-09-02";"What are those bright lights in the sky ahead?  When hiking a high mountain pass in northern Italy three weeks ago, a conjunction between our Moon and the distant planet Jupiter was visible toward the south just after sunset. The picturesque mountains in the distance are Tre Cime di Lavaredo (Three Peaks of Lavaredo), a UNESCO World Heritage Site and three of the best known mountain peaks in Italy, the Dolomites, and the entire Alps. In the foreground on the left is Locatelli Hut, a refuge for tired hikers as it is located over an hour from nearest parking lot. The bright sky object on the upper left is Saturn.  The entire scene was captured on a single 8-second exposure.  Jupiter and Saturn will remain prominent in the southwestern sky after sunset this month, while the Moon, in its monthly orbit around the Earth, will pass near Jupiter again in about four days.";"The Moon and Jupiter over the Alps";"https://apod.nasa.gov/apod/image/1909/MoonJupiterPass_Hofer_960.jpg"
144;"2019-09-04";"Will the spider ever catch the fly? Not if both are large emission nebulas toward the constellation of the Charioteer (Auriga).  The spider-shaped gas cloud on the left is actually an emission nebula labelled IC 417, while a smaller fly-shaped cloud off the image to the left is dubbed  NGC 1931 and is both an emission nebula and a reflection nebula.  About 10,000 light-years distant, both nebulas harbor young, open star clusters. For scale, the more compact NGC 1931 (Fly) is about 10 light-years across. The featured picture in scientifically-assigned, infrared colors combines images from the Spitzer Space Telescope and the Two Micron All Sky Survey (2MASS).  Spitzer is celebrating its 16th year orbiting the Sun near the Earth.    APOD in other languages: Arabic, Catalan, Chinese (Beijing), Chinese (Taiwan), Croatian, Czech, Dutch, Farsi, French, French, German, Hebrew, Indonesian, Japanese, Korean, Montenegrin, Polish, Russian, Serbian, Slovenian,  Spanish and Ukrainian";"The Spider Nebula in Infrared";"https://apod.nasa.gov/apod/image/1909/SpiderFly_Spitzer2Mass_960.jpg"
145;"2019-09-05";"The 16th century Portuguese navigator Ferdinand Magellan and his crew had plenty of time to study the southern sky during the first circumnavigation of planet Earth. As a result, two fuzzy cloud-like objects easily visible to southern hemisphere skygazers are known as the Clouds of Magellan, now understood to be satellite galaxies of our much larger, spiral Milky Way galaxy. About 160,000 light-years distant in the constellation Dorado, the Large Magellanic Cloud (LMC) is seen here in a remarkably deep, colorful, image. Spanning about 15,000 light-years or so, it is the most massive of the Milky Way's satellite galaxies and is the home of the closest supernova in modern times, SN 1987A.  The prominent patch below center is 30 Doradus, also known as the magnificent Tarantula Nebula, a giant star-forming region about 1,000 light-years across.";"The Large Cloud of Magellan";"https://apod.nasa.gov/apod/image/1909/Magellano22detail22_1980enan11curves11_s1024.jpg"
146;"2019-09-10";"What color is Pluto, really? It took some effort to figure out.  Even given all of the images sent back to Earth when the robotic New Horizons spacecraft sped past Pluto in 2015, processing these multi-spectral frames to approximate what the human eye would see was challenging. The result featured here, released three years after the raw data was acquired by New Horizons, is the highest resolution true color image of Pluto ever taken. Visible in the image is the light-colored, heart-shaped, Tombaugh Regio, with the unexpectedly smooth Sputnik Planitia, made of frozen nitrogen, filling its western lobe. New Horizons found the dwarf-planet to have a surprisingly complex surface composed of many regions having perceptibly different hues.  In total, though, Pluto is mostly brown, with much of its muted color originating from small amounts of surface methane energized by ultraviolet light from the Sun.";"Pluto in True Color";"https://apod.nasa.gov/apod/image/1909/PlutoTrueColor_NewHorizons_960.jpg"
147;"2019-09-11";"What energizes the Heart Nebula? First, the large emission nebula dubbed IC 1805 looks, in whole, like a human heart.  The nebula glows brightly in red light emitted by its most prominent element: hydrogen.  The red glow and the larger shape are all powered by a small group of stars near the nebula's center.  In the center of the Heart Nebula are young stars from the open star cluster Melotte 15 that are eroding away several picturesque dust pillars with their energetic light and winds. The open cluster of stars contains a few bright stars nearly 50 times the mass of our Sun, many dim stars only a fraction of the mass of our Sun, and an absent microquasar that was expelled millions of years ago.  The Heart Nebula is located about 7,500 light years away toward the constellation of Cassiopeia.  Coincidentally, a small meteor was captured in the foreground during imaging  and is visible above the dust pillars.  At the top right is the companion Fishhead Nebula.";"IC 1805: The Heart Nebula";"https://apod.nasa.gov/apod/image/1909/HeartNebula_Falls_960.jpg"
148;"2019-09-13";"Famed in festival, story, and song the best known full moon is the Harvest Moon. For northern hemisphere dwellers that's a traditional name of the full moon nearest the September equinox. In most North America time zones this year's Harvest Moon will officially rise on Friday, September 13. In fact the same Harvest Moon will rise on September 14 for much of the planet though. Of course the Moon will look almost full in the surrounding days. Regardless of your time zone the Harvest Moon, like any other full moon, will rise just opposite the setting Sun. Near the horizon, the Moon Illusion might make it appear bigger and brighter to you but this Harvest Moon will be near lunar apogee. That's the farthest point in its orbit, making it the most distant, and so the smallest, full moon of the year. On August 15 a wheat field harvested in south central France made this a harvest moon scene too, the full moon shining on with beautiful iridescent clouds at sunset.";"A Harvest Moon";"https://apod.nasa.gov/apod/image/1909/HarvestmoonGraffand.jpg"
149;"2019-09-17";"Where else might life exist?  One of humanity's great outstanding questions, locating planets where extrasolar life might survive took a step forward recently with the discovery of a significant amount of water vapor in the atmosphere of distant exoplanet K2-18b. The planet and it parent star, K2-18, lie about 124 light years away toward the constellation of the Lion (Leo). The exoplanet is significantly larger and more massive than our Earth, but orbits in the habitable zone of its home star. K2-18, although more red than our Sun, shines in K2-18b's sky with a brightness similar to the Sun in Earth's sky.  The discovery was made in data from three space telescopes: Hubble, Spitzer, and Kepler, by noting the absorption of water-vapor colors when the planet moved in front of the star.  The featured illustration imagines exoplanet K2-18b on the right, its parent red dwarf star K2-18 on the left, and an unconfirmed sister planet between them.";"Water Vapor Discovered on Distant Exoplanet";"https://apod.nasa.gov/apod/image/1909/K218b_ESAKornmesser_1080.jpg"
150;"2019-09-19";"Delicate in appearance, these filaments of shocked, glowing gas, are draped across planet Earth's sky toward the constellation of Cygnus.";"Along the Western Veil";"https://apod.nasa.gov/apod/image/1909/veilXie1100.jpg"
151;"2019-09-21";"Framing a bright emission region, this telescopic view looks out across a pretty field of stars along the plane of our Milky Way Galaxy, toward the nebula rich constellation Cygnus the Swan. Popularly called the Tulip Nebula, the reddish glowing cloud of interstellar gas and dust is also found in the 1959 catalog by astronomer Stewart Sharpless as Sh2-101. About 8,000 light-years distant and 70 light-years across the complex and beautiful nebula blossoms near the center of this composite image. Ultraviolet radiation from young energetic O stars at the edge of the Cygnus OB3 association, ionizes the atoms and powers the emission from the Tulip Nebula.";"The Tulip in the Swan";"https://apod.nasa.gov/apod/image/1909/Tulip_CropRobertEder1024.jpg"
152;"2019-09-23";"Today is an equinox, a date when day and night are equal.  Tomorrow, and every day until the next equinox, the night will be longer than the day in Earth's northern hemisphere, and the day will be longer than the night in Earth's southern hemisphere. An equinox occurs midway between the two solstices, when the days and nights are the least equal. The featured picture is a composite of hourly images taken of the Sun above Bursa, Turkey on key days from solstice to equinox to solstice. The bottom Sun band was taken during the north's winter solstice in 2007 December, when the Sun could not rise very high in the sky nor stay above the horizon very long.   This lack of Sun caused winter. The top Sun band was taken during the northern summer solstice in 2008 June, when the Sun rose highest in the sky and stayed above the horizon for more than 12 hours.  This abundance of Sun caused summer. The middle band was taken during an equinox in 2008 March, but it is the same sun band that Earthlings see today, the day of the most recent  equinox.   Browser-Enhanced APOD: Google Chrome extensions (free, user created and maintained)";"Equinox: The Sun from Solstice to Solstice";"https://apod.nasa.gov/apod/image/1909/seasons_tezel_1080.jpg"
153;"2019-09-24";"What are these strange shapes on Mars?  Defrosting sand dunes. As Spring dawned on the Northern Hemisphere of Mars, dunes of sand near the pole, as pictured here in late May by ESA's ExoMars Trace Gas Orbiter, began to thaw.  The carbon dioxide and water ice actually sublime in the thin atmosphere directly to gas.  Thinner regions of ice typically defrost first revealing sand whose darkness soaks in sunlight and accelerates the thaw.  The process might even involve sandy jets exploding through the thinning ice.  By Summer, spots will expand to encompass the entire dunes.  The Martian North Pole is ringed by many similar fields of barchan sand dunes, whose strange, smooth arcs are shaped by persistent Martian winds.   Create a Distant Legacy: Send your name to Mars.";"Sand Dunes Thawing on Mars";"https://apod.nasa.gov/apod/image/1909/DunesThawingOnMars_ExoMars_1080.jpg"
154;"2019-09-25";"The Pelican Nebula is slowly being transformed.  IC 5070, the official designation, is divided from the larger North America Nebula by a molecular cloud filled with dark dust.  The Pelican, however, receives much study because it is a particularly active mix of star formation and evolving gas clouds.  The featured picture was produced in three specific colors -- light emitted by sulfur, hydrogen, and oxygen --  that can help us to better understand these interactions.  The light from young energetic stars is slowly transforming the cold gas to hot gas, with the advancing boundary between the two, known as an ionization front, visible in bright orange on the right. Particularly dense tentacles of cold gas remain.  Millions of years from now this nebula might no longer be known as the Pelican, as the balance and placement of stars and gas will surely leave something that appears completely different.";"The Pelican Nebula in Gas, Dust, and Stars";"https://apod.nasa.gov/apod/image/1909/Pelican_Akar_960.jpg"
155;"2019-09-26";"An old Moon rose this morning, its waning sunlit crescent shining just above the eastern horizon before sunrise. But earthshine, light reflected from a bright planet Earth, lit the shadowed portion of the lunar disk and revealed most of a familiar lunar near side to early morning risers. In fact, a description of earthshine in terms of sunlight reflected by Earth's oceans illuminating the Moon's dark surface was written over 500 years ago by Leonardo da Vinci. One lunation ago this old Moon also rose above the eastern horizon. Its sunlit crescent and da Vinci glow were captured in stacked exposures from the Badain Jilin Desert of Inner Mongolia, China on August 29, 2019. This year marks the 500th anniversary of Leondardo da Vinci's death.";"Da Vinci Rise";"https://apod.nasa.gov/apod/image/1909/DaVinciRisingLikaiLin_1024.jpg"
